{
  "schema_version": "phase-1b-w8-acceptance-profile@1",
  "name": "w8-final-target",
  "temporary": false,
  "reason": "Final W8 acceptance target.",
  "dataset_path": "eval/w8-jira-gitlab-eval-current.json",
  "required_sample_count": 50,
  "required_real_joint_sample_count": 20,
  "accept_rate_target": 0.4,
  "require_review_metrics": true,
  "review_time_target_minutes": 10,
  "final_target": {
    "required_sample_count": 50,
    "required_real_joint_sample_count": 20
  }
}
